{
  "buildBackendDigest": {
    "algorithm": "sha256",
    "value": "42238b4e6bfdf384a323c10023eaef3dba71dbd10d6e6cb709be213151b6b1b4"
  },
  "exclusions": [
    "distribution/source-identity.json",
    "docs/requirements/tracked-files.yaml",
    "docs/validation/repository-validation.json"
  ],
  "files": [
    {
      "byteLength": 213,
      "path": ".editorconfig",
      "rawDigest": {
        "algorithm": "sha256",
        "value": "b6f1b7f9f0c85bf0c9d2cdc7a19cd7003bd8155ec4094743d2e30553dbfb4d0d"
      }
    },
    {
      "byteLength": 899,
      "path": ".github/dependabot.yml",
      "rawDigest": {
        "algorithm": "sha256",
        "value": "5e948078ff276af7a4e07828d2727607a175a53b7dca09cc8c95fc4d4eae9aef"
      }
    },
    {
      "byteLength": 1138,
      "path": ".github/workflows/ci.yml",
      "rawDigest": {
        "algorithm": "sha256",
        "value": "7d229ee591360976c3a8d44d5bbd6bc0f75b52ae1861cd46f72251880a63eebb"
      }
    },
    {
      "byteLength": 365,
      "path": ".github/workflows/conformance.yml",
      "rawDigest": {
        "algorithm": "sha256",
        "value": "da7e3e3254084c87297b53493e17d38be35061a8cda394051af4274aeea9207b"
      }
    },
    {
      "byteLength": 211,
      "path": ".github/workflows/dependency-review.yml",
      "rawDigest": {
        "algorithm": "sha256",
        "value": "8224c048b18f8c87409b334842c7698c59519b8157c4437ae580b5460a829bf3"
      }
    },
    {
      "byteLength": 603,
      "path": ".github/workflows/l9-nightly.yml",
      "rawDigest": {
        "algorithm": "sha256",
        "value": "16bf165e4307504f95324d2ba0b4f2055a6af4fe9495f39b8573d4251f603e3c"
      }
    },
    {
      "byteLength": 437,
      "path": ".github/workflows/release.yml",
      "rawDigest": {
        "algorithm": "sha256",
        "value": "7da5d0da61f95e857bbef51408f66855e104c68448f9d7017fdcd7235ce4d0b3"
      }
    },
    {
      "byteLength": 181,
      "path": ".gitignore",
      "rawDigest": {
        "algorithm": "sha256",
        "value": "1f1604c200d0e514b8092440c03f7b42d297ef92c2fc8e7bc7418a68f687362d"
      }
    },
    {
      "byteLength": 160,
      "path": ".pre-commit-config.yaml",
      "rawDigest": {
        "algorithm": "sha256",
        "value": "0086cc9da820d579792d9ed89a947fbeca9712e51dab370e9c421f9a9f7ac90f"
      }
    },
    {
      "byteLength": 5,
      "path": ".python-version",
      "rawDigest": {
        "algorithm": "sha256",
        "value": "02e735b3dfe1c32833eb550b7ff8ffa17f5f2bc3fa1e7bae61a8f5a3883ce398"
      }
    },
    {
      "byteLength": 888,
      "path": "AGENTS.md",
      "rawDigest": {
        "algorithm": "sha256",
        "value": "810e0c1f687a5db4a6ab96dedb5771cc5b8fe1cc6bb7b81a17945d6c7b0eaa4a"
      }
    },
    {
      "byteLength": 2806,
      "path": "ALIGNMENT_REPORT.md",
      "rawDigest": {
        "algorithm": "sha256",
        "value": "4aeef0e5b8669ea5e034d492724006f2af5f17fa80c690bee31947c5e4be3df9"
      }
    },
    {
      "byteLength": 3668,
      "path": "ARCHITECTURE.md",
      "rawDigest": {
        "algorithm": "sha256",
        "value": "694ce957688c33aa416ef7e3cc3440886f37daab4c802e8b4ce27bae4d6c6661"
      }
    },
    {
      "byteLength": 912,
      "path": "BUILD_AUTHORIZATION.md",
      "rawDigest": {
        "algorithm": "sha256",
        "value": "d18a22d1f39c5fcef969ee972fa764ce4c37fa04e0f498f3cbbe84855e9a6f9a"
      }
    },
    {
      "byteLength": 5068,
      "path": "CHANGELOG.md",
      "rawDigest": {
        "algorithm": "sha256",
        "value": "ede566525c1a3c415640d416997f27cf8c968aa858be9a5bb01585149309f64c"
      }
    },
    {
      "byteLength": 1857,
      "path": "CHANGE_SUMMARY.md",
      "rawDigest": {
        "algorithm": "sha256",
        "value": "09770c49ed09c864c1d7ee521365a48eaec101de1f3bbbb06f47a86c146ddc64"
      }
    },
    {
      "byteLength": 697,
      "path": "CONTRIBUTING.md",
      "rawDigest": {
        "algorithm": "sha256",
        "value": "e3e01a05708cd2f8836888b1ec71cd1967786ff268503801fc82f7185a047ba2"
      }
    },
    {
      "byteLength": 1639,
      "path": "CONVERGENCE_REPORT.yaml",
      "rawDigest": {
        "algorithm": "sha256",
        "value": "eed2fd1b423ecf273b00318ee82217e35f0ee88298ba5ce1b1ed23961a4957ba"
      }
    },
    {
      "byteLength": 2041,
      "path": "DECISION_LOG.md",
      "rawDigest": {
        "algorithm": "sha256",
        "value": "7b434efec4bd4801633e2b31e683e4aa7cede8679657f142b084f4f5b1851883"
      }
    },
    {
      "byteLength": 1471,
      "path": "DISTRIBUTION_ALIGNMENT.md",
      "rawDigest": {
        "algorithm": "sha256",
        "value": "62c0d4faec0dca8e583312bbab5654a4a936173c9464ddda05dd13b7d00be935"
      }
    },
    {
      "byteLength": 12625,
      "path": "FILETREE.md",
      "rawDigest": {
        "algorithm": "sha256",
        "value": "23b723e402d4c0c62307510f1a9677e375f9ef1c4ea8c1cdc4c34b8cde6024bf"
      }
    },
    {
      "byteLength": 905,
      "path": "L9_META.yaml",
      "rawDigest": {
        "algorithm": "sha256",
        "value": "20e0005e69edf6197416b0b7507e9e83a83cc2aa91552231d73df50829a25426"
      }
    },
    {
      "byteLength": 4658,
      "path": "LICENSE",
      "rawDigest": {
        "algorithm": "sha256",
        "value": "40480115927c1985499925b32072e1bcb4f48e86432af9bffbf9d2a718e28a2d"
      }
    },
    {
      "byteLength": 18132,
      "path": "MANIFEST.md",
      "rawDigest": {
        "algorithm": "sha256",
        "value": "a2528e160277f994009f499c2613e11c99ab87bb6a69e564107bae0c390fdbb6"
      }
    },
    {
      "byteLength": 1062,
      "path": "PROVENANCE_MAP.yaml",
      "rawDigest": {
        "algorithm": "sha256",
        "value": "113fd0bc7191fdfaa6b131d07804b22ff2542ae66ca87b24c8338fe649b6694e"
      }
    },
    {
      "byteLength": 5131,
      "path": "README.md",
      "rawDigest": {
        "algorithm": "sha256",
        "value": "6d15981cd6c82ae908f7fedb5f82f851b22c3fd5fbeb7dc9f9b1ade053d61ab9"
      }
    },
    {
      "byteLength": 3633,
      "path": "REGRESSION_GUARD.md",
      "rawDigest": {
        "algorithm": "sha256",
        "value": "bf09c129ed4226f02c7b87c3b6e1851550b6b0086cfa3a41c29c731cf07383b1"
      }
    },
    {
      "byteLength": 1689,
      "path": "RELEASE_READINESS.yaml",
      "rawDigest": {
        "algorithm": "sha256",
        "value": "6177e5b3e450f95ea1e5b1268ba590674a867e98d93040c89e8324606685e1e6"
      }
    },
    {
      "byteLength": 1090,
      "path": "ROADMAP.md",
      "rawDigest": {
        "algorithm": "sha256",
        "value": "714a2aaaf21aace174f2e5618abf5d80f541f7590d72140ca59cfa118dc90113"
      }
    },
    {
      "byteLength": 5104,
      "path": "RUNBOOK.md",
      "rawDigest": {
        "algorithm": "sha256",
        "value": "a150d9f7d332d48a15f41e1c00f94a9e2ca425766b1fec84df7ae9623a6b6f48"
      }
    },
    {
      "byteLength": 1556,
      "path": "SECURITY.md",
      "rawDigest": {
        "algorithm": "sha256",
        "value": "044fbd72dc4081830a87c1ab94a0e22bf8b2ccd65402cc1b833970163c07aee6"
      }
    },
    {
      "byteLength": 149736,
      "path": "SPECIFICATION.md",
      "rawDigest": {
        "algorithm": "sha256",
        "value": "ba547d113206c6d28e7aa0037e77a015081812de1ee57c0e2f43a88abbe1fab9"
      }
    },
    {
      "byteLength": 11029,
      "path": "TRACEABILITY_MAP.yaml",
      "rawDigest": {
        "algorithm": "sha256",
        "value": "dcaa7a3a020aebc773f36523d1c6e06e8e4afff56e9a43801bd992199add36cc"
      }
    },
    {
      "byteLength": 2002,
      "path": "UNKNOWN_REGISTER.md",
      "rawDigest": {
        "algorithm": "sha256",
        "value": "665589aa5320b3871bfe6b7d42d9e9815e49310d8ac262b4c7933948b0930fb0"
      }
    },
    {
      "byteLength": 3834,
      "path": "VALIDATION.md",
      "rawDigest": {
        "algorithm": "sha256",
        "value": "633fd92cf8ede05eadb417dff939f8632d13c62e1fce984f3d36e6cf81269589"
      }
    },
    {
      "byteLength": 5881,
      "path": "build_backend.py",
      "rawDigest": {
        "algorithm": "sha256",
        "value": "42238b4e6bfdf384a323c10023eaef3dba71dbd10d6e6cb709be213151b6b1b4"
      }
    },
    {
      "byteLength": 268,
      "path": "docs/adr/ADR-001-harness-role.md",
      "rawDigest": {
        "algorithm": "sha256",
        "value": "08752707d9c4616c24d4732f5636e7fb562cb8955a669401348befaf82187d2e"
      }
    },
    {
      "byteLength": 252,
      "path": "docs/adr/ADR-002-authority-path.md",
      "rawDigest": {
        "algorithm": "sha256",
        "value": "a9bd44c759bb4098d8c1f298f05e6a17e42f4f39912001454ea0a91669d0d86c"
      }
    },
    {
      "byteLength": 275,
      "path": "docs/adr/ADR-003-artifact-layout.md",
      "rawDigest": {
        "algorithm": "sha256",
        "value": "c6a0df014d19164b8bfa7849dd25e29ed4502bee556d5bf1405f8426be231450"
      }
    },
    {
      "byteLength": 257,
      "path": "docs/adr/ADR-004-no-competing-envelope.md",
      "rawDigest": {
        "algorithm": "sha256",
        "value": "427cb254c92e80b4c276e1918b23c27d036f1e4acd21cc936c58732831f64554"
      }
    },
    {
      "byteLength": 250,
      "path": "docs/adr/ADR-005-fallback-isolation.md",
      "rawDigest": {
        "algorithm": "sha256",
        "value": "f29ecd75f1565d8c3d786cc581dab9da74f3401a6e201046fc287fdb87db131c"
      }
    },
    {
      "byteLength": 257,
      "path": "docs/adr/ADR-006-digest-scopes.md",
      "rawDigest": {
        "algorithm": "sha256",
        "value": "99feefa892443c4f07cbde792035e2278482b9772407bc839e5ab17cca9fb66a"
      }
    },
    {
      "byteLength": 244,
      "path": "docs/adr/ADR-007-simulation-authority.md",
      "rawDigest": {
        "algorithm": "sha256",
        "value": "c54a87cc565aec636416688b88bdabbdc55f684e53ff859e1326f866e311f9d3"
      }
    },
    {
      "byteLength": 292,
      "path": "docs/adr/ADR-008-cross-language.md",
      "rawDigest": {
        "algorithm": "sha256",